University of Colorado Boulder	Exhibition: Animals In Antiquity (9/18/2015 - 9/1/2016)	<![CDATA[Animals in Antiquity
A collaborative exhibition between the CU Art Museum and the CU Museum of Natural History 
On view September 18, 2015 - September 2016 
The desire to assign symbolic meanings to animals that share our world links human cultures across time. Whether rendered figuratively or abstractly, depictions of animals remind us not only of themselves but also of the qualities and traits we assign to them. They can illustrate human traitsthe coyote as trickster, the cat aloofand teach children behaviors and ideals from fables. Humans have worshipped animals, hunted and consumed them for food, and altered the natural environments of animals, all in the name of humanity.
This exhibition is a celebration of animals in art and animals as artifacts. The objects are from across the Earth and span the last 4,000 years of human history. We invite you to ponder what these objects represented and how the makers used them in their daily lives.    
Curated by Erin Baxter, doctoral candidate in anthropology
This exhibition is generously supported by the Department of Classics, CU Boulder Student Arts and Cultural Enrichment fees, and CU Art Museum members.]]>	Fri, 18 Sep 2015 06:00:00 GMT	Uncategorized	http://events.colorado.edu/EventList.aspx?view=EventDetails&eventidn=33459&information_id=146258&type=&rss=rss	
University of Colorado Boulder	Graduate Accounting Program (MS, MSBA) (10/6/2015 - 10/6/2016)	<![CDATA[informational meeting for prospective students interested in Accounting careers.  Five-year concurrent degree bachelor/master degree with accounting emphasis or standalone master's degree.  Room KOBL 235]]>	Tue, 6 Oct 2015 23:00:00 GMT	Uncategorized	http://events.colorado.edu/EventList.aspx?view=EventDetails&eventidn=33301&information_id=145253&type=&rss=rss	
University of Colorado Boulder	LIBRARIES EXHIBIT  - And there’s the humor of it: Shakespeare and the four humors (12/16/2015 - 1/23/2016)	<![CDATA[William Shakespeare (15641616) created characters that are among the richest and most humanly recognizable in all of literature. Yet Shakespeare understood human personality in the terms available to his agethat of the now-discarded theory of the four bodily humorsblood, bile, melancholy, and phlegm. These four humors were thought to define peoples physical and mental health, and determined their personalities, as well. "And theres the humor of it": Shakespeare and the four humors explores the language of the four humors that bred the core passions of anger, grief, hope, and fearthe emotions conveyed so powerfully in Shakespeares comedies and tragedies.
View the U.S. National Library of Medicine exhibit on display in Norlin Librarys Science Gallery, 2nd floor West entrance December 16th  January 23rd
 Accompanying materials:

    An online version of the exhibition is available at: https://www.nlm.nih.gov/exhibition/shakespeare/index.html. 
    Lesson plan for a  higher education module and additional resources are available at: https://www.nlm.nih.gov/exhibition/shakespeare/education/index.html

Contact Barb Losoff for more information.]]>	Wed, 16 Dec 2015 07:00:00 GMT	Uncategorized	http://events.colorado.edu/EventList.aspx?view=EventDetails&eventidn=34486&information_id=149222&type=&rss=rss	
University of Colorado Boulder	Extreme Bowling Saturday Nights (1/23/2016)	<![CDATA[Friday  Saturday Nights 7pm-close
Enjoy the fun of bowling to great tunes with BLACK LIGHTS, colored lane lights and color pins. It's definitely the ONLY Extreme Bowling you'll find in Boulder and anywhere near campus! 
Win prizes for Color Head Pin Strikes! Note, in order to win a prize, you must tell the Connection Staff before bowling for a color pin strike.

Learn about everything The Connection offers at www.colorado.edu/umc/connection.
Bowling, Billiards, Games, Wii, TVs, WiFi, food  drink...]]>	Sun, 24 Jan 2016 02:00:00 GMT	Uncategorized	http://events.colorado.edu/EventList.aspx?view=EventDetails&eventidn=33008&information_id=143772&type=&rss=rss	
University of Colorado Boulder	Exhibit: What does space mean to you? (1/24/2016)	<![CDATA[The CU Museum of Natural History asks local elementary students, What do you think is the most interesting discovery made through our study of space? Come see their responses and add your own answers at a special exhibit in the museum. You may even see your response on the museums Twitter feed @cumuseumevents.]]>	Sun, 24 Jan 2016 17:00:00 GMT	Uncategorized	http://events.colorado.edu/EventList.aspx?view=EventDetails&eventidn=33427&information_id=145652&type=&rss=rss	
University of Colorado Boulder	Undergraduate Senior Recital: Ryan Farris, cello (1/24/2016)	<![CDATA[
    

Cellist Ryan Farris presents his senior recital, featuring pianist Barbie Noyes. The program includes Schumann's Fantasy Pieces, Britten's Cello Suite No.1, and Haydn's Cello Concerto in D Major.

PROGRAM: Schumann,  Britten and Haydn

University of Colorado Boulder College of Music
colorado.edu/music/events

Google map to venue

PROGRAM: Granados, Obradors

University of Colorado Boulder College of Music
colorado.edu/music/events

Google map to venue

]]>	Sun, 24 Jan 2016 23:30:00 GMT	Uncategorized	http://events.colorado.edu/EventList.aspx?view=EventDetails&eventidn=34736&information_id=149911&type=&rss=rss	
University of Colorado Boulder	I Love Mondays (1/25/2016)	<![CDATA[I Love Mondays is hosted in the UMC on Mondays from 2pm - 3pm. Join us for different events such as tie-dye, cookie decorating, a live dj, pumpkin painting, build-a-bear workshop, and more! 
This weekly event is designed to provide a place where students can build a community and introduce them to the UMC. I Love Mondays also helps to support large events on campus while encouraging student involvement. This event is always free and a great way to cure your case of the Mondays. 
Take a break from studying and do something fun to start off your week! ]]>	Mon, 25 Jan 2016 07:00:00 GMT	Uncategorized	http://events.colorado.edu/EventList.aspx?view=EventDetails&eventidn=33480&information_id=149308&type=&rss=rss	
University of Colorado Boulder	Scholarship Deadline: NPCA Scholarships (1/25/2016)	<![CDATA[The National Precast Concrete Association Foundation awards scholarships to undergraduate and graduate students enrolled in civil engineering, architectural and construction-related fields of study.
Applicants must complete an application, essay, submit 2 letters of recommendation and a transcript of high school or college grades.
For more information and to apply, visit: http://precast.org/foundation/scholarships/
Deadline to apply: January 25, 2016]]>	Mon, 25 Jan 2016 07:00:00 GMT	Uncategorized	http://events.colorado.edu/EventList.aspx?view=EventDetails&eventidn=34556&information_id=149420&type=&rss=rss	
University of Colorado Boulder	Exhibit: What does space mean to you? (1/25/2016)	<![CDATA[The CU Museum of Natural History asks local elementary students, What do you think is the most interesting discovery made through our study of space? Come see their responses and add your own answers at a special exhibit in the museum. You may even see your response on the museums Twitter feed @cumuseumevents.]]>	Mon, 25 Jan 2016 16:00:00 GMT	Uncategorized	http://events.colorado.edu/EventList.aspx?view=EventDetails&eventidn=33427&information_id=145653&type=&rss=rss	
University of Colorado Boulder	Bowling & Billiards Weekday Break Specials from $1 (1/25/2016)	<![CDATA[TAKE A BREAK TODAY!
Mondays - Fridays
Weekday Bowling Breaks:
Early-Bird Special (10am-2pm): $1/game/per person; $1/shoe rental for everyone
Mid-Day Special (2pm-5pm): Half regular game rate; $1.25/shoe rental

Weekday Billiards Breaks:
Early-Bird Special (10am-2pm): $1/hour per person
Mid-Day Special (2pm-5pm): Half regular rate

Check out all the things offered at The Connection at www.colorado.edu/umc/connection
Bowling, billiards, video games, poker, karaoke, tournaments, TVs, WiFi, food  drink...
]]>	Mon, 25 Jan 2016 17:00:00 GMT	Uncategorized	http://events.colorado.edu/EventList.aspx?view=EventDetails&eventidn=33009&information_id=143997&type=&rss=rss	
University of Colorado Boulder	Close Looking: details from our collection (1/25/2016)	<![CDATA[Close Looking: details from our collection
An exhibition curated by the CU Art Museum and presented as part of BMoCA at Macky
On view January 11 - February 28, 2016
What makes a museum? For us at the CU Art Museum an important pillar is our collection of over 8,000 objects spanning human history. Each photograph in this exhibition is a highly magnified detail of an object in our collection; each one selected by a different member of our museum staff. These objects inspire usfrom small ancient coins to large contemporary paintingsand the personal connections we make with them inform how we look at the collection as a whole.
This project illustrates our desire to promote new ways of looking at our collection. Interested in seeing more? Visit the museum, located at the Visual Arts Complex, to make your own personal connections. Were opening three new exhibitions featuring objects from our collection on February 12, 2016.]]>	Mon, 25 Jan 2016 17:00:00 GMT	Uncategorized	http://events.colorado.edu/EventList.aspx?view=EventDetails&eventidn=34756&information_id=149961&type=&rss=rss	
University of Colorado Boulder	GRMN 2010 (1/25/2016)	<![CDATA[GRMN 2010]]>	Mon, 25 Jan 2016 18:00:00 GMT	Uncategorized	http://events.colorado.edu/EventList.aspx?view=EventDetails&eventidn=34388&information_id=148903&type=&rss=rss	
University of Colorado Boulder	ENVS Colloquium (1/25/2016)	<![CDATA[Navigating Climate Change: Communication and cultural politics in the 21st Century
Maxwell Boykoff, ENVS/CIRES
SEEC Auditorium, 4001 Discovery Drive
Refreshments to follow

​ ]]>	Mon, 25 Jan 2016 19:10:00 GMT	Uncategorized	http://events.colorado.edu/EventList.aspx?view=EventDetails&eventidn=34840&information_id=150578&type=&rss=rss	
University of Colorado Boulder	Swedish 1120 (1/25/2016)	<![CDATA[Swedish 1120]]>	Mon, 25 Jan 2016 20:00:00 GMT	Uncategorized	http://events.colorado.edu/EventList.aspx?view=EventDetails&eventidn=34342&information_id=148637&type=&rss=rss	
University of Colorado Boulder	Monday Workshops: Teaching Portfolio - Creating Your Own Career (1/25/2016)	<![CDATA[Teaching Portfolio: Creating Your Own Career
Laura
L.
B.
Border,
Director,
Graduate
Teacher
Program
Where do you want to go in your academic career? Which academic environment are you best suited for? This workshop uses the teaching portfolio to help you answer these questions for yourself and for the hiring committee.     ]]>	Mon, 25 Jan 2016 21:00:00 GMT	Uncategorized	http://events.colorado.edu/EventList.aspx?view=EventDetails&eventidn=34812&information_id=150384&type=&rss=rss	
University of Colorado Boulder	Swedish 2020 (1/25/2016)	<![CDATA[Swedish 2020]]>	Mon, 25 Jan 2016 21:00:00 GMT	Uncategorized	http://events.colorado.edu/EventList.aspx?view=EventDetails&eventidn=34343&information_id=148666&type=&rss=rss	
University of Colorado Boulder	Tuition Classification 101: Emancipation (1/25/2016)	<![CDATA[Location: Regent Administrative Center, room 1B60 (lower level)

Anyone interested in petitioning for Colorado residency may attend an on-campus Tuition Classification 101 session; attendance is required for students needing to prove emancipation. 

Sessions are scheduled on alternating Mondays and Thursdays from 2 to 3 p.m. during the semester. Seating is limited, so please reserve your seat by clicking the Register icon. An email with specific directions to the session will be sent out prior to the event. 

Attending one of these sessions is the only way to obtain a residency petition for emancipation.

If you qualify for accommodations because of a disability, please submit your Disability Services letter to the Office of the Registrar in a timely manner so your needs can be addressed. Disability Services determines accommodations based on documented disabilities. Contact Disability Services at 303-492-8671 or by email at dsinfo@colorado.edu.]]>	Mon, 25 Jan 2016 21:00:00 GMT	Uncategorized	http://events.colorado.edu/EventList.aspx?view=EventDetails&eventidn=34372&information_id=148841&type=&rss=rss	
University of Colorado Boulder	Swedish 3020 (1/25/2016)	<![CDATA[Swedish 3020]]>	Mon, 25 Jan 2016 23:00:00 GMT	Uncategorized	http://events.colorado.edu/EventList.aspx?view=EventDetails&eventidn=34344&information_id=148695&type=&rss=rss	
University of Colorado Boulder	Time Management-The Key to a Successful Semester! (1/25/2016)	<![CDATA[(Held in Fleming 170) Need a time management tune-up to start the semester out right?  If you felt that last semester felt a bit more stressful than it should have been, you didn't get things done as efficiently (or effectively) as you had hoped, come to this workshop. 

Sooner would be better than later, and now would be better than sooner." - Tyrion
― George R.R. Martin, A Storm of Sword]]>	Mon, 25 Jan 2016 23:00:00 GMT	Uncategorized	http://events.colorado.edu/EventList.aspx?view=EventDetails&eventidn=34669&information_id=149757&type=&rss=rss	
University of Colorado Boulder	"Children Divided: War Orphans in the Japanese Empire" - Dr. Mariko Asano Tamanoi, UCLA (1/25/2016)	<![CDATA[The Center for Asian Studies and the Department of History Welcomes
Children Divided: War Orphans in the Japanese Empire
CAS Speaker Series - Transcultural Asia
Monday, January 25, 5:00 p.m.
Economics 205, CU-Boulder

This is a talk by Professor Mariko Asano Tamanoi, Department of Anthropology, University of California Los Angeles. Her talk will explore how children displaced by war in both Japan and China came to inspire a transcultural legal discourse on the rights of minors. In the aftermath of World War II, children, especially orphans, were at once divided, protected, and oppressed by different political forces--the Japanese state, the Nationalists and the Communists in China, and the U.S. Occupation Forces. The messy realities surrounding both Japanese and Chinese children were in part created by the idea of the "rights of the child" but also by other novel constructions of the time: "the nation's children," "the empire's children," and "social work" (shakai jigyō). These ideas coexisted with both older visions of "philanthropy" and a new concept of humanitarian aid. How did notions of the universal child (as it was expressed in the phrase "children of the world") take shape in East Asia? In what ways did these notions interact with imperial, national, and social forces? Finally, what distinguishes colonial intervention from humanitarian aids?

Sponsored by the Center for Asian Studies and the Department of History. Brought to you with generous funding from the Japanese Ministry of Foreign Affairs.

For a complete list of our events, please visit http://www.colorado.edu/cas/event-list.]]>	Tue, 26 Jan 2016 00:00:00 GMT	Uncategorized	http://events.colorado.edu/EventList.aspx?view=EventDetails&eventidn=34801&information_id=150362&type=&rss=rss	
University of Colorado Boulder	Children Divided: War Orphans in the Japanese Empire (1/25/2016)	<![CDATA[This is a talk by Professor Mariko Asano Tamanoi, Department of Anthropology, University of California Los Angeles. Her talk will explore how children displaced by war in both Japan and China came to inspire a transcultural legal discourse on the rights of minors. In the aftermath of World War II, children, especially orphans, were at once divided, protected, and oppressed by different political forces--the Japanese state, the Nationalists and the Communists in China, and the U.S. Occupation Forces. The messy realities surrounding both Japanese and Chinese children were in part created by the idea of the "rights of the child" but also by other novel constructions of the time: "the nation's children," "the empire's children," and "social work" (shakai jigyō). These ideas coexisted with both older visions of "philanthropy" and a new concept of humanitarian aid. How did notions of the universal child (as it was expressed in the phrase "children of the world") take shape in East Asia? In what ways did these notions interact with imperial, national, and social forces? Finally, what distinguishes colonial intervention from humanitarian aids?
Sponsored by the Center for Asian Studies and the Department of History. Brought to you with generous funding from the Japanese Ministry of Foreign Affairs.

This event will be held in Economics 205.]]>	Tue, 26 Jan 2016 00:00:00 GMT	Uncategorized	http://events.colorado.edu/EventList.aspx?view=EventDetails&eventidn=34780&information_id=150305&type=&rss=rss	
University of Colorado Boulder	How to Network at Campus Career Events (Engineering) (1/25/2016)	<![CDATA[This workshop will focus on training you on how to approach and talk to employers, specifically when they hold informational sessions or attend career fairs. In the next couple of weeks, there will be a variety of Career Services events, where employers will be on campus. Learn how to use that time effectively. All engineering students welcome! Located in ECCR 155, Engineering Center.]]>	Tue, 26 Jan 2016 00:00:00 GMT	Uncategorized	http://events.colorado.edu/EventList.aspx?view=EventDetails&eventidn=34510&information_id=149297&type=&rss=rss	
University of Colorado Boulder	Prep for Meet Buff Employers: How to Refine Your Resume (1/25/2016)	<![CDATA[Prepare to Meet Buff Employers by learning how to create and refine your resume.
Come and have your questions answered about resumes, and find the best way to showcase your skills and experience. We are here to help you market yourself to employers! 
For individual resume critiques checkout our Drop-In schedule: Every M-Th 1:30-3:45pm for 15-minute resume reviews in Career Services, C4C, N352]]>	Tue, 26 Jan 2016 00:00:00 GMT	Uncategorized	http://events.colorado.edu/EventList.aspx?view=EventDetails&eventidn=34616&information_id=149602&type=&rss=rss	
University of Colorado Boulder	Study Finance in London in Summer 2016!  Interest meeting January 25, 2016 (1/25/2016)	<![CDATA[Study international finance in London this summer. This seminar includes lectures from prominent financial professionals and field trips to sites such as Lloyds of London, Bloomberg and Paris! Eligibility requirements include a minimum 2.5 GPA and coursework in Business or Economics. To learn more, join us on Monday, January 25th at 5:00 - 6:00 pm in KOBL 203.  http://studyabroad.colorado.edu/?go=LondonGS ]]>	Tue, 26 Jan 2016 00:00:00 GMT	Uncategorized	http://events.colorado.edu/EventList.aspx?view=EventDetails&eventidn=34735&information_id=149909&type=&rss=rss	
University of Colorado Boulder	Africa in French (1/25/2016)	<![CDATA[Africa in French Non-Credit
Constantine]]>	Tue, 26 Jan 2016 00:30:00 GMT	Uncategorized	http://events.colorado.edu/EventList.aspx?view=EventDetails&eventidn=34417&information_id=149054&type=&rss=rss	
University of Colorado Boulder	ENVD Lecture Series with Tuline Gulgonin (1/25/2016)	<![CDATA[Please join the Program in Environmental Design for a free and public lecture by Tuline Gulgonin, "School Children's Representations of Urban Public Spaces in Mexico City."]]>	Tue, 26 Jan 2016 00:45:00 GMT	Uncategorized	http://events.colorado.edu/EventList.aspx?view=EventDetails&eventidn=34762&information_id=150265&type=&rss=rss	
University of Colorado Boulder	Monday Night Bowl (1/25/2016)	<![CDATA[Mondays, 6pm-close
Come alone. Come with friends. Come with family. AND have fun! This is the best entertainment deal.
Only $8 per person for 2 hours unlimited bowling. Shoes and a fountain drink are included!
To learn about everything The Connection offers, visit www.colorado.edu/umc/connection. 
Bowling, Billiards, Games, Wii, TVs, Food, Drink, WiFi...]]>	Tue, 26 Jan 2016 01:00:00 GMT	Uncategorized	http://events.colorado.edu/EventList.aspx?view=EventDetails&eventidn=33005&information_id=143671&type=&rss=rss	
University of Colorado Boulder	Fall 2015 Deadline to Submit Degree-Posting Changes to Registrar (Noon) (1/26/2016)	<![CDATA[Graduation coordinators must submit any last-minute changes for degree posting by noon to the Office of the Registrar. See also the Fall 2015 Dean's Commencement Calendar.]]>	Tue, 26 Jan 2016 07:00:00 GMT	Uncategorized	http://events.colorado.edu/EventList.aspx?view=EventDetails&eventidn=34537&information_id=149381&type=&rss=rss	
University of Colorado Boulder	Exhibit: What does space mean to you? (1/26/2016)	<![CDATA[The CU Museum of Natural History asks local elementary students, What do you think is the most interesting discovery made through our study of space? Come see their responses and add your own answers at a special exhibit in the museum. You may even see your response on the museums Twitter feed @cumuseumevents.]]>	Tue, 26 Jan 2016 16:00:00 GMT	Uncategorized	http://events.colorado.edu/EventList.aspx?view=EventDetails&eventidn=33427&information_id=145654&type=&rss=rss	
University of Colorado Boulder	Bowling & Billiards Weekday Break Specials from $1 (1/26/2016)	<![CDATA[TAKE A BREAK TODAY!
Mondays - Fridays
Weekday Bowling Breaks:
Early-Bird Special (10am-2pm): $1/game/per person; $1/shoe rental for everyone
Mid-Day Special (2pm-5pm): Half regular game rate; $1.25/shoe rental

Weekday Billiards Breaks:
Early-Bird Special (10am-2pm): $1/hour per person
Mid-Day Special (2pm-5pm): Half regular rate

Check out all the things offered at The Connection at www.colorado.edu/umc/connection
Bowling, billiards, video games, poker, karaoke, tournaments, TVs, WiFi, food  drink...
]]>	Tue, 26 Jan 2016 17:00:00 GMT	Uncategorized	http://events.colorado.edu/EventList.aspx?view=EventDetails&eventidn=33009&information_id=143998&type=&rss=rss	
University of Colorado Boulder	Close Looking: details from our collection (1/26/2016)	<![CDATA[Close Looking: details from our collection
An exhibition curated by the CU Art Museum and presented as part of BMoCA at Macky
On view January 11 - February 28, 2016
What makes a museum? For us at the CU Art Museum an important pillar is our collection of over 8,000 objects spanning human history. Each photograph in this exhibition is a highly magnified detail of an object in our collection; each one selected by a different member of our museum staff. These objects inspire usfrom small ancient coins to large contemporary paintingsand the personal connections we make with them inform how we look at the collection as a whole.
This project illustrates our desire to promote new ways of looking at our collection. Interested in seeing more? Visit the museum, located at the Visual Arts Complex, to make your own personal connections. Were opening three new exhibitions featuring objects from our collection on February 12, 2016.]]>	Tue, 26 Jan 2016 17:00:00 GMT	Uncategorized	http://events.colorado.edu/EventList.aspx?view=EventDetails&eventidn=34756&information_id=149962&type=&rss=rss	
University of Colorado Boulder	GRMN 2010 (1/26/2016)	<![CDATA[GRMN 2010]]>	Tue, 26 Jan 2016 18:00:00 GMT	Uncategorized	http://events.colorado.edu/EventList.aspx?view=EventDetails&eventidn=34388&information_id=148904&type=&rss=rss	
University of Colorado Boulder	Procrastination v.s. Anticrastination. (1/26/2016)	<![CDATA[(Held in C4C, Ste N320)  Procrastination v.s. Anticrastinationits your choice.]]>	Tue, 26 Jan 2016 22:30:00 GMT	Uncategorized	http://events.colorado.edu/EventList.aspx?view=EventDetails&eventidn=34671&information_id=149761&type=&rss=rss	
University of Colorado Boulder	Nonlinear Waves Seminar - Patrick Shipman (1/26/2016)	<![CDATA[Patrick Shipman, Department of Mathematics, Colorado State University

Topological measures of order for templated pattern-forming systems

When
the surface of a nominally flat binary material is bombarded with a
broad, normally incident ion beam, disordered hexagonal arrays of
nanodots can form.  Defects, such as dislocations in ripple
patterns or penta-hepta pairs in hexagonal arrays, limit
the utility of patterns produced by ion bombardment.  Together with D.
Pearson, F. Motta, and M. Bradley, we have proposed a method, namely
templating the surface, to increase the order in the patterns. To
evaluate the efficacy of this method, a means of quantifying the degree
of order is needed.  We compare time-honored methods, such as the
autocorrelation function, with new topological methods we propose which
utilize persistent homology.   ]]>	Tue, 26 Jan 2016 23:00:00 GMT	Uncategorized	http://events.colorado.edu/EventList.aspx?view=EventDetails&eventidn=34598&information_id=149552&type=&rss=rss	
University of Colorado Boulder	TIGER 1 Workshops: Teaching as Public Speaking (1/26/2016)	<![CDATA[Teaching
as
Public
Speaking 
Andrew
Long,
GTP
RA,
Graduate
Teacher
Program 

In this workshop, we will discuss practical strategies to create engaging and effective lectures and recitations. Specifically, we will focus on constructing and presenting lessons and encouraging discussion in the classroom. We will talk about positive ways to address apprehensions about public speaking that you may have in front of your students.]]>	Tue, 26 Jan 2016 23:00:00 GMT	Uncategorized	http://events.colorado.edu/EventList.aspx?view=EventDetails&eventidn=34813&information_id=150386&type=&rss=rss	
University of Colorado Boulder	Buff Talks: Public Service (1/26/2016)	<![CDATA[Buff Talks: Public Service - Tuesday, January 26, 5 - 6:30pm; Center for Community (C4C) Abrams Lounge.

Be empowered. Explore careers in public service from experts in the field. Learn from panelists about their career paths and how to get involved. 

Panelists include: 

Rachel Folk, AmeriCorps NCCC
Sarah Roeder, City Year
Chessye Moseley, Teach For America
David Boggs, Peace Corps]]>	Wed, 27 Jan 2016 00:00:00 GMT	Uncategorized	http://events.colorado.edu/EventList.aspx?view=EventDetails&eventidn=34618&information_id=149606&type=&rss=rss	
