Little Theater - Limited Seating	2016-04-09 19:30:00 Sat	Uncategorized	http://ruevents.rutgers.edu/events/displayEvent.html?eventId=83306	
Rutgers University	Rutgers Symphony Orchestra with Rutgers Kirkpatrick Choir: "Gloria!"	Patrick Gardner, director
Min Kwon, piano
Featuring Riverside Choral Society
Program includes Aldridges "Variations on a Folk Tune" for piano solo and orchestra, Poulencs "Gloria," and Duruflés "Requiem," in a musical celebration of the 250th anniversary of Rutgers.	2016-04-09 19:30:00 Sat	Uncategorized	http://ruevents.rutgers.edu/events/displayEvent.html?eventId=83350	
Rutgers University	Rutgers University Musicological Society Graduate Student Conference 2016	A platform for graduate students in musicology, music theory, and ethnomusicology to exchange ideas and present original research.	2016-04-10 11:00:00 Sun	Uncategorized	http://ruevents.rutgers.edu/events/displayEvent.html?eventId=83358	
Rutgers University	Catholic Mass	Mass with prayer, scripture, music and reception of Communion.	2016-04-10 12:00:00 Sun	Uncategorized	http://ruevents.rutgers.edu/events/displayEvent.html?eventId=83620	
Rutgers University	BFA Senior Dance Concert	Wednesday, April 6Friday, April 8, 7:30 p.m.
Saturday, April 9, 2 and 7:30 p.m.
Sunday, April 10, 2 p.m.
New choreographic group works by BFA senior dance majors	2016-04-10 14:00:00 Sun	Uncategorized	http://ruevents.rutgers.edu/events/displayEvent.html?eventId=83290	
Rutgers University	Rutgers Theater Company presents: "A Dream Play"	By August Strindberg
A goddess, the daughter of Indra, comes down to Earth in order to experience for herself the burdens and beauties of what it means to be a human being.
Little Theater - Limited Seating	2016-04-10 14:00:00 Sun	Uncategorized	http://ruevents.rutgers.edu/events/displayEvent.html?eventId=83307	
Rutgers University	Catholic Mass	Mass with prayer, scripture, music and reception of Communion.	2016-04-10 18:00:00 Sun	Uncategorized	http://ruevents.rutgers.edu/events/displayEvent.html?eventId=83630	
Rutgers University	Catholic Mass	Mass with prayer, scripture, music and reception of Communion.	2016-04-10 18:00:00 Sun	Uncategorized	http://ruevents.rutgers.edu/events/displayEvent.html?eventId=83640	
Rutgers University	Catholic Mass	Full Mass with prayer, scripture, music, reception of Communion  Takes place at St. Peters Church, 94 Somerset St, CAC	2016-04-10 20:00:00 Sun	Uncategorized	http://ruevents.rutgers.edu/events/displayEvent.html?eventId=83665	
Rutgers University	Basic Chainsaw Safety	In this half-day class, Certified Tree Expert Steve Chisholm will go over the basic safety procedures every chainsaw operator should know, from appropriate clothing and safety gear to proper cutting techniques.	2016-04-11 08:30:00 Mon	Uncategorized	http://ruevents.rutgers.edu/events/displayEvent.html?eventId=83409	
Rutgers University	Summer Session Info Table	Visit us at the LSC for information on Summer Session and giveaways!	2016-04-11 12:00:00 Mon	Uncategorized	http://ruevents.rutgers.edu/events/displayEvent.html?eventId=83802	
Rutgers University	The Louis J. Gambaccini Civic Engagement Series presents: The Honorable Sonia Sotomayor	U.S. Supreme Court Associate Justice Sonia Sotomayor. Monday, April 11, 2015 at 3:00 pm, location TBA. Registration opens in 2016.	2016-04-11 15:00:00 Mon	Uncategorized	http://ruevents.rutgers.edu/events/displayEvent.html?eventId=82831	
Rutgers University	Auditor's Workshop: Managing Environmental Compliance	Gain a better understanding of how sustainability can improve your company's environmental, economic and social goals in this course.	2016-04-12 09:00:00 Tue	Uncategorized	http://ruevents.rutgers.edu/events/displayEvent.html?eventId=83775	
Rutgers University	The Teaching Portfolio	As you prepare for an academic job search, you will need to develop a teaching portfolio. If you want to know the best way to create a portfolio that will serve as the basis of your career teaching portfolio, attend this session. Special attention will be given to writing your teaching philosophy.	2016-04-12 12:00:00 Tue	Uncategorized	http://ruevents.rutgers.edu/events/displayEvent.html?eventId=83405	
Rutgers University	Mindfulness Meditation	Mindfulness is the art of being a compassionate observer of our own experience.  Mindfulness meditation helps us reduce stress & be calmer.  All are welcome, beginners and those with previous experience.  Workshops are free.  No registration, special clothes or equipment required.	2016-04-12 12:00:00 Tue	Uncategorized	http://ruevents.rutgers.edu/events/displayEvent.html?eventId=83494	
Rutgers University	Summer Session Info Table	Visit us at the CASC for information on Summer Session and giveaways!	2016-04-12 12:00:00 Tue	Uncategorized	http://ruevents.rutgers.edu/events/displayEvent.html?eventId=83803	
Rutgers University	Rutgers Theater Company presents: "A Dream Play"	By August Strindberg
A goddess, the daughter of Indra, comes down to Earth in order to experience for herself the burdens and beauties of what it means to be a human being.
Little Theater - Limited Seating	2016-04-12 19:30:00 Tue	Uncategorized	http://ruevents.rutgers.edu/events/displayEvent.html?eventId=83308	
Rutgers University	CSA Spirit Night	Spirit Night is the Catholic Student Associations weekly meeting, involving a topic, prayer,  & music. All undergrads welcome.	2016-04-12 20:00:00 Tue	Uncategorized	http://ruevents.rutgers.edu/events/displayEvent.html?eventId=83601	
Rutgers University	Rigorous Reading: 5 Access Points for Teaching Complex  Texts and Other Comprehension Strategies	Call it close reading, call it deep reading, call it analytic readingcall it what you like. The point is, its a level of understanding that students of any age can achieve with the right kind of instruction.  In this session, you will articulate an instructional plan, squarely built on research.	2016-04-13 09:00:00 Wed	Uncategorized	http://ruevents.rutgers.edu/events/displayEvent.html?eventId=81635	
Rutgers University	Summer Session Info Table	Visit us at the BSC for information on Summer Session and giveaways!	2016-04-13 12:00:00 Wed	Uncategorized	http://ruevents.rutgers.edu/events/displayEvent.html?eventId=83804	
Rutgers University	Mindfulness Meditation	Mindfulness is the art of being a compassionate observer of our own experience.  Mindfulness meditation helps us reduce stress & be calmer.  All are welcome, beginners and those with previous experience.  Workshops are free.  No registration, special clothes or equipment required.	2016-04-13 12:00:00 Wed	Uncategorized	http://ruevents.rutgers.edu/events/displayEvent.html?eventId=83513	
Rutgers University	Neurology Grand Rounds	Case Presentation	2016-04-13 12:30:00 Wed	Uncategorized	http://ruevents.rutgers.edu/events/displayEvent.html?eventId=83183	
Rutgers University	Neurology Grand Rounds	Case Presentation	2016-04-13 12:30:00 Wed	Uncategorized	http://ruevents.rutgers.edu/events/displayEvent.html?eventId=83168	
Rutgers University	Interviewing for Life Sciences & Health Professions	,Interviewing for Life Sciences & Health Professions	2016-04-13 13:30:00 Wed	Uncategorized	http://ruevents.rutgers.edu/events/displayEvent.html?eventId=83251	
Rutgers University	Drawing Club for Children and Young People: 6-8YO and 9-14YO	Children discover the secrets of drawing when they participate in the Zimmerlis popular Drawing Club, which takes place on Wednesdays after school in the fall and spring semesters.	2016-04-13 16:15:00 Wed	Uncategorized	http://ruevents.rutgers.edu/events/displayEvent.html?eventId=83421	
Rutgers University	PMAc Information Session	Crowne Plaza
Plainsboro Township, NJ	2016-04-13 18:00:00 Wed	Uncategorized	http://ruevents.rutgers.edu/events/displayEvent.html?eventId=83570	
Rutgers University	Professional MBA Information Session	Crowne Plaza
Plainsboro Township, NJ	2016-04-13 18:00:00 Wed	Uncategorized	http://ruevents.rutgers.edu/events/displayEvent.html?eventId=83564	
Rutgers University	Yvonne Rainer: "Doing Nothing/Nothin' Doin': Revisiting a Minimalist Approach to Performance"	Renowned American dancer, choreographer, and filmmaker Yvonne Rainer
Lecture followed by Q&A	2016-04-13 19:30:00 Wed	Uncategorized	http://ruevents.rutgers.edu/events/displayEvent.html?eventId=83297	
Rutgers University	Rutgers Theater Company presents: "A Dream Play"	By August Strindberg
A goddess, the daughter of Indra, comes down to Earth in order to experience for herself the burdens and beauties of what it means to be a human being.
Little Theater - Limited Seating	2016-04-13 19:30:00 Wed	Uncategorized	http://ruevents.rutgers.edu/events/displayEvent.html?eventId=83309	
Rutgers University	Writers at Rutgers: Mark Doty & Belinda McKeon	Mark Doty, author of Deep Lane, and Belinda McKeon, author of Tender, are part of the Writers at Rutgers Reading Series and will be reading at this free event, open to the public, with a book signing and dessert reception to follow.	2016-04-13 20:00:00 Wed	Uncategorized	http://ruevents.rutgers.edu/events/displayEvent.html?eventId=82935	
Rutgers University	International Child Assault Prevention Conference	The 2016 ICAP Conference will bring together legislators, educators, businesses, and community services to celebrate CAP Projects worldwide and showcase 30 years of New Jerseys efforts in the work of prevention of child abuse and bullying.	2016-04-14 08:00:00 Thu	Uncategorized	http://ruevents.rutgers.edu/events/displayEvent.html?eventId=83257	
Rutgers University	NJDEP Vapor Intrusion Guidance	In this one-day seminar, instructors will present the State's approach to Vapor Intrusion as outlined in the Vapor Intrusion Technical (VIT) Guidance document and discuss upcoming changes being made to the VIT Guidance.	2016-04-14 08:30:00 Thu	Uncategorized	http://ruevents.rutgers.edu/events/displayEvent.html?eventId=83722	
Rutgers University	Summer Online Information Session	Want to learn more about the Rutgers University-New Brunswick Summer Session? Join us for an online information session and have a chance to win free summer tuition. Register and view more event information here: http://summer.rutgers.edu/attend-online-information-session	2016-04-14 11:00:00 Thu	Uncategorized	http://ruevents.rutgers.edu/events/displayEvent.html?eventId=83265	
Rutgers University	Negotiation of Psychiatric Medication Decisions in the Era of Patient-Centered Medicine	Beth Angell is an associate professor in the School of Social Work and Core Faculty at the Institute for Health, Health Care Policy and Aging Research and Galina Bolden is an associate professor in the School of Communication and Information.	2016-04-14 12:00:00 Thu	Uncategorized	http://ruevents.rutgers.edu/events/displayEvent.html?eventId=83751	
Rutgers University	Mindfulness Meditation	Mindfulness is the art of being a compassionate observer of our own experience.  Mindfulness meditation helps us reduce stress & be calmer.  All are welcome, beginners and those with previous experience.  Workshops are free.  No registration, special clothes or equipment required.	2016-04-14 12:00:00 Thu	Uncategorized	http://ruevents.rutgers.edu/events/displayEvent.html?eventId=83535	
Rutgers University	Summer Session Info Table	Visit us at the DSC for information on Summer Session and giveaways!	2016-04-14 12:00:00 Thu	Uncategorized	http://ruevents.rutgers.edu/events/displayEvent.html?eventId=83805	
Rutgers University	Ecology and Evolution Graduate Program Seminar: Dr. Ken Andersen - "Characteristic sizes of life in the ocean"	All E&E seminars are open to the public.	2016-04-14 16:00:00 Thu	Uncategorized	http://ruevents.rutgers.edu/events/displayEvent.html?eventId=83762	
Rutgers University	Rodig Lecture	Join the German Department for Spring 2016 Rodig Lecture presented by Eva Horn, University of Vienna	2016-04-14 16:30:00 Thu	Uncategorized	http://ruevents.rutgers.edu/events/displayEvent.html?eventId=83726	
Rutgers University	Visiting Filmmaker Series: Lav Diaz, "Storm Children, Book One"	A documentary about the devastation caused by Typhoon Haiyan (aka Yolanda), the deadliest in the Philippines history, shot in stark black and white.	2016-04-14 18:00:00 Thu	Uncategorized	http://ruevents.rutgers.edu/events/displayEvent.html?eventId=83812	
Rutgers University	Visiting Filmmaker Series: Philippe Grandrieux, "Un Lac"	Alexi is a woodcutter struggling with epilepsy in a snowbound community in the North, where he lives a secluded life with his family, who are his only companions. The balance of this tight-knit family is thrown off by the arrival of a wandering lumberjack in this French drama.	2016-04-14 18:00:00 Thu	Uncategorized	http://ruevents.rutgers.edu/events/displayEvent.html?eventId=83811	
Rutgers University	Rutgers Theater Company presents: "A Dream Play"	By August Strindberg
A goddess, the daughter of Indra, comes down to Earth in order to experience for herself the burdens and beauties of what it means to be a human being.
Little Theater - Limited Seating	2016-04-14 19:30:00 Thu	Uncategorized	http://ruevents.rutgers.edu/events/displayEvent.html?eventId=83310	
Rutgers University	Recycling Collection Techniques	In this two-day, hands-on course you will learn the techniques required to make and defend decisions regarding collection, develop the skills needed to understand how generation rates are computed, learn the "how-to's" of waste and recycling contracting, and explore Heuristic routing.	2016-04-13 08:30:00 Wed	Uncategorized	http://ruevents.rutgers.edu/events/displayEvent.html?eventId=81727	
Rutgers University	Introduction to Adobe Connect	Attendees will learn how to obtain an account through Sakai, set up a meeting, and use the various features such as file sharing, link sharing, PowerPoint presenting, audio/video conferencing, polling questions, and live chat.	2016-04-15 09:45:00 Fri	Uncategorized	http://ruevents.rutgers.edu/events/displayEvent.html?eventId=83397	
Rutgers University	Rodig Seminar	Join the German Department for Spring 2016 Rodig Seminar presented by Eva Horn, University of Vienna	2016-04-15 10:00:00 Fri	Uncategorized	http://ruevents.rutgers.edu/events/displayEvent.html?eventId=83727	
Rutgers University	"Deciphering the molecular basis of pesticide resistance to support smarter pest control"	"Deciphering the molecular basis of pesticide resistance to support smarter pest control"	2016-04-15 11:00:00 Fri	Uncategorized	http://ruevents.rutgers.edu/events/displayEvent.html?eventId=83689	
Rutgers University	Rutgers Gardens Winter Farm Market	Come out to support our farm market vendors and enjoy some locally produced and prepared products. 3rd Friday of each month, January through April, weather permitting. Vendors may vary each month. Join our mailing list to receive updates on vendors and specials they will have available.	2016-04-15 11:00:00 Fri	Uncategorized	http://ruevents.rutgers.edu/events/displayEvent.html?eventId=83577	
Rutgers University	Rutgers Public Engagement Project panel: Developing an Online Presence: Websites, Social Media, and Blogging for Academics	This Rutgers Public Engagement Project panel addresses issues in establishing a media presence for academics, using websites and social media tools.	2016-04-15 13:00:00 Fri	Uncategorized	http://ruevents.rutgers.edu/events/displayEvent.html?eventId=83380	
Rutgers University	Darius Milhauds Cantata from Proverbs for female voices with oboe, harp, and cello; as well as works by contemporary composers including Steve Reich, Tarik ORegan, and Edgar Girtain IV.	Darius Milhauds "Cantata from Proverbs" for female voices with oboe, harp, and cello; as well as works by contemporary composers including Steve Reich, Tarik ORegan, and Edgar Girtain IV.	2016-04-15 19:30:00 Fri	Uncategorized	http://ruevents.rutgers.edu/events/displayEvent.html?eventId=83368	
Rutgers University	Rutgers Theater Company presents: "A Dream Play"	By August Strindberg
A goddess, the daughter of Indra, comes down to Earth in order to experience for herself the burdens and beauties of what it means to be a human being.
Little Theater - Limited Seating	2016-04-15 19:30:00 Fri	Uncategorized	http://ruevents.rutgers.edu/events/displayEvent.html?eventId=83311	
Rutgers University	Rutgers Theater Company presents: "A Dream Play"	By August Strindberg
A goddess, the daughter of Indra, comes down to Earth in order to experience for herself the burdens and beauties of what it means to be a human being.
Little Theater - Limited Seating	2016-04-16 14:00:00 Sat	Uncategorized	http://ruevents.rutgers.edu/events/displayEvent.html?eventId=83304	
Rutgers University	Rutgers Symphony Orchestra with Rutgers Kirkpatrick Choir: "Gloria!"	Patrick Gardner, director
Min Kwon, piano
Featuring Riverside Choral Society
Program includes Aldridges "Variations on a Folk Tune" for piano solo and orchestra, Poulencs "Gloria," and Duruflés "Requiem," in a musical celebration of the 250th anniversary of Rutgers.	2016-04-16 19:30:00 Sat	Uncategorized	http://ruevents.rutgers.edu/events/displayEvent.html?eventId=83351	
Rutgers University	Rutgers Chamber Jazz Ensembles	Small-ensemble jazz heralding artists including Charlie Parker, Thelonious Monk, and Dexter Gordon. A select four of the schools 12 chamber jazz and alternate large jazz ensembles will perform, featuring student musicians.	2016-04-16 19:30:00 Sat	Uncategorized	http://ruevents.rutgers.edu/events/displayEvent.html?eventId=83359	
Rutgers University	Catholic Mass	Mass with prayer, scripture, music and reception of Communion.	2016-04-17 12:00:00 Sun	Uncategorized	http://ruevents.rutgers.edu/events/displayEvent.html?eventId=83621	
Rutgers University	Music at the Museum	The Zimmerli hosts a monthly weekend concert series organized by the Mason Gross Extension Division and featuring artists from Mason Gross School of the Arts Extension Division and Collegiate Music Department.	2016-04-17 13:00:00 Sun	Uncategorized	http://ruevents.rutgers.edu/events/displayEvent.html?eventId=82580	
Rutgers University	Helix New Music Ensemble	World premieres from faculty and student composers alongside chamber works of the 20th and 21st centuries.	2016-04-17 14:00:00 Sun	Uncategorized	http://ruevents.rutgers.edu/events/displayEvent.html?eventId=83360	
Rutgers University	Organ program recital	Works by J.S. Bach, Guilain, and Mendelssohn, plus improvisations.	2016-04-17 17:00:00 Sun	Uncategorized	http://ruevents.rutgers.edu/events/displayEvent.html?eventId=83366	
Rutgers University	Catholic Mass	Mass with prayer, scripture, music and reception of Communion.	2016-04-17 18:00:00 Sun	Uncategorized	http://ruevents.rutgers.edu/events/displayEvent.html?eventId=83631	
Rutgers University	Catholic Mass	Mass with prayer, scripture, music and reception of Communion.	2016-04-17 18:00:00 Sun	Uncategorized	http://ruevents.rutgers.edu/events/displayEvent.html?eventId=83641	
Rutgers University	Brass Bash	A celebratory showcase of Mason Gross chamber music students.	2016-04-17 19:30:00 Sun	Uncategorized	http://ruevents.rutgers.edu/events/displayEvent.html?eventId=83329	
Rutgers University	Catholic Mass	Full Mass with prayer, scripture, music, reception of Communion  Takes place at St. Peters Church, 94 Somerset St, CAC	2016-04-17 20:00:00 Sun	Uncategorized	http://ruevents.rutgers.edu/events/displayEvent.html?eventId=83666	
Rutgers University	Effective Environmental Field Sampling and Data Collection	If you have recently entered the field of environmental management or are looking to improve your skills in this area, consider attending this NEW half-day course that focuses on field sampling procedures, data collection, and preliminary report preparation.	2016-04-18 08:30:00 Mon	Uncategorized	http://ruevents.rutgers.edu/events/displayEvent.html?eventId=83770	
Rutgers University	Rutgers Mingus Band	The music of bassist and bandleader Charles Mingus, featuring selections from Me, Myself, an Eye. Tenor saxophonist and alum Abe Burton leads the ensemble.	2016-04-18 19:30:00 Mon	Uncategorized	http://ruevents.rutgers.edu/events/displayEvent.html?eventId=83330	
Rutgers University	Water & Wastewater Chemistry: Back to the Basics	This course presents the basic chemistry and treatment methodologies used in drinking water and wastewater operations.	2016-04-19 08:30:00 Tue	Uncategorized	http://ruevents.rutgers.edu/events/displayEvent.html?eventId=83040	
Rutgers University	Mindfulness Meditation	Mindfulness is the art of being a compassionate observer of our own experience.  Mindfulness meditation helps us reduce stress & be calmer.  All are welcome, beginners and those with previous experience.  Workshops are free.  No registration, special clothes or equipment required.	2016-04-19 12:00:00 Tue	Uncategorized	http://ruevents.rutgers.edu/events/displayEvent.html?eventId=83495	
Rutgers University	60 Minute Job Search Boot Camp	Did you know that students who utilize their university career centers have a higher rate of job search success? Are you aware that a wide array of regional and national employers are using rooms in our facilities to interview students for full-time and internship positions?

Don't le...	2016-04-19 14:00:00 Tue	Uncategorized	http://ruevents.rutgers.edu/events/displayEvent.html?eventId=83236	
Rutgers University	CSA Spirit Night	Spirit Night is the Catholic Student Associations weekly meeting, involving a topic, prayer,  & music. All undergrads welcome.	2016-04-19 20:00:00 Tue	Uncategorized	http://ruevents.rutgers.edu/events/displayEvent.html?eventId=83602	
Rutgers University	Craig Young Scholar Lecture Series: Kristina Mendicino	Join the German Department for the inaugural semester of this new lecture series dedicated to young scholars of German. Kristina Mendicino will present, "Undoing--Creating--Anew: On Else Lasker-Schueler's Der Siebente and the Neue Gemeinschaft."	2016-04-20 12:00:00 Wed	Uncategorized	http://ruevents.rutgers.edu/events/displayEvent.html?eventId=83725	
Rutgers University	Mindfulness Meditation	Mindfulness is the art of being a compassionate observer of our own experience.  Mindfulness meditation helps us reduce stress & be calmer.  All are welcome, beginners and those with previous experience.  Workshops are free.  No registration, special clothes or equipment required.	2016-04-20 12:00:00 Wed	Uncategorized	http://ruevents.rutgers.edu/events/displayEvent.html?eventId=83514	
Rutgers University	Summer Internship 101	Learn the difference between traditional and behavioral interviewing, which questions employers ask most often and strategies to make a positive impression in an interview.	2016-04-20 16:00:00 Wed	Uncategorized	http://ruevents.rutgers.edu/events/displayEvent.html?eventId=83230	
Rutgers University	Drawing Club for Children and Young People: 6-8YO and 9-14YO	Children discover the secrets of drawing when they participate in the Zimmerlis popular Drawing Club, which takes place on Wednesdays after school in the fall and spring semesters.	2016-04-20 16:15:00 Wed	Uncategorized	http://ruevents.rutgers.edu/events/displayEvent.html?eventId=83422	
Rutgers University	Traditional MBA Information Session	Rutgers University-Camden
     Business and Science Building 
     2nd floor, Conference room
     227 Penn Street
     Camden, NJ 08102
     5:30pm to 7:00pm	2016-04-20 17:30:00 Wed	Uncategorized	http://ruevents.rutgers.edu/events/displayEvent.html?eventId=83542	
Rutgers University	Split the Lark New Music Ensemble	Saturday, April 2, 7:30 p.m.	2016-04-20 19:30:00 Wed	Uncategorized	http://ruevents.rutgers.edu/events/displayEvent.html?eventId=83367	
Rutgers University	Rutgers Sinfonia	Gershwins "An American in Paris," Stamitzs Viola Concerto, Shostakovichs Symphony No. 9.	2016-04-20 19:30:00 Wed	Uncategorized	http://ruevents.rutgers.edu/events/displayEvent.html?eventId=83331	
Rutgers University	DancePlus Spring	Works by Mason Gross faculty and award-winning guest artists including Joe Goode (Bessie and Izzie Awards), Yvonne Rainer (MacArthur and Guggenheim) and Netta Yerushalmy (Guggenheim).	2016-04-20 19:30:00 Wed	Uncategorized	http://ruevents.rutgers.edu/events/displayEvent.html?eventId=83280	
Rutgers University	NJDEP Case Study Training for LSRPs	This interactive one-day workshop will engage Licensed Site Remediation Professionals (LSRPs) and other environmental professionals to work through a typical Site Remediation Program (SRP) Case.	2016-04-21 08:30:00 Thu	Uncategorized	http://ruevents.rutgers.edu/events/displayEvent.html?eventId=83010	
Rutgers University	Mindfulness Meditation	Mindfulness is the art of being a compassionate observer of our own experience.  Mindfulness meditation helps us reduce stress & be calmer.  All are welcome, beginners and those with previous experience.  Workshops are free.  No registration, special clothes or equipment required.	2016-04-21 12:00:00 Thu	Uncategorized	http://ruevents.rutgers.edu/events/displayEvent.html?eventId=83536	
Rutgers University	Rutgers Concert Band	Timothy G. Smith, conductor	2016-04-21 19:30:00 Thu	Uncategorized	http://ruevents.rutgers.edu/events/displayEvent.html?eventId=83332	
Rutgers University	DancePlus Spring	Works by Mason Gross faculty and award-winning guest artists including Joe Goode (Bessie and Izzie Awards), Yvonne Rainer (MacArthur and Guggenheim) and Netta Yerushalmy (Guggenheim).	2016-04-21 19:30:00 Thu	Uncategorized	http://ruevents.rutgers.edu/events/displayEvent.html?eventId=83281	
Rutgers University	Using Innovative Teaching Methods and Technology to Enhance Learning by Undergraduate Students	Seminar focuses on teaching methods and technology that improve interactive learning in the classroom and online. Enhancement of student communication skills using classroom debates on ethical issues related to companion animals along with use of an in-class engagement tool will be discussed.	2016-04-22 09:15:00 Fri	Uncategorized	http://ruevents.rutgers.edu/events/displayEvent.html?eventId=83464	
