Rutgers University	Rutgers Theater Company presents: "Silentium"	Wednesday, March 2Saturday, March 5 at 7:30 p.m.
Sunday, March 6 at 2 p.m.
A devised piece in which students explore text and storytelling through movement.	2016-03-05 19:30:00 Sat	Uncategorized	http://ruevents.rutgers.edu/events/displayEvent.html?eventId=83302	
Rutgers University	Spring Dance Concert	New choreographic works by Dance majors	2016-03-05 19:30:00 Sat	Uncategorized	http://ruevents.rutgers.edu/events/displayEvent.html?eventId=83293	
Rutgers University	Rutgers Symphony Orchestra	Strausss Till Eulenspiegel, Wagners Wesendonck Lieder, Mahlers Symphony No. 1.	2016-03-05 19:30:00 Sat	Uncategorized	http://ruevents.rutgers.edu/events/displayEvent.html?eventId=83327	
Rutgers University	Rutgers Women's Gymnastics	Gymnastics vs. Towson/West Chester/Southern Connecticut State	2016-03-06 01:00:00 Sun	Uncategorized	http://ruevents.rutgers.edu/events/displayEvent.html?eventId=83153	
Rutgers University	Rutgers Women's Tennis	Women's Tennis vs. College of Charleston	2016-03-06 12:00:00 Sun	Uncategorized	http://ruevents.rutgers.edu/events/displayEvent.html?eventId=83156	
Rutgers University	Rutgers Women's Tennis	Women's Tennis vs. College of Charleston	2016-03-06 12:00:00 Sun	Uncategorized	http://ruevents.rutgers.edu/events/displayEvent.html?eventId=83157	
Rutgers University	Catholic Mass	Mass with prayer, scripture, music and reception of Communion.	2016-03-06 12:00:00 Sun	Uncategorized	http://ruevents.rutgers.edu/events/displayEvent.html?eventId=83618	
Rutgers University	Passport to Art	Travel the world of art on Family First Sundays throughout the year!	2016-03-06 13:00:00 Sun	Uncategorized	http://ruevents.rutgers.edu/events/displayEvent.html?eventId=82569	
Rutgers University	Rutgers Theater Company presents: "Silentium"	Wednesday, March 2Saturday, March 5 at 7:30 p.m.
Sunday, March 6 at 2 p.m.
A devised piece in which students explore text and storytelling through movement.	2016-03-06 14:00:00 Sun	Uncategorized	http://ruevents.rutgers.edu/events/displayEvent.html?eventId=83303	
Rutgers University	Bruk-Hoffmann Duo: Ballet and Opera for Two Pianos	Karina Bruk and Paul Hoffmann, pianos
Tchaikovskys Nutcracker Suite,op 71a; Gershwins Porgy and Bess Fantasy; Coplands Selections from Billy the Kid, and Borodins Polovtsian Dances from Prince Igor.	2016-03-06 14:00:00 Sun	Uncategorized	http://ruevents.rutgers.edu/events/displayEvent.html?eventId=83328	
Rutgers University	Catholic Mass	Mass with prayer, scripture, music and reception of Communion.	2016-03-06 18:00:00 Sun	Uncategorized	http://ruevents.rutgers.edu/events/displayEvent.html?eventId=83628	
Rutgers University	Catholic Mass	Mass with prayer, scripture, music and reception of Communion.	2016-03-06 18:00:00 Sun	Uncategorized	http://ruevents.rutgers.edu/events/displayEvent.html?eventId=83638	
Rutgers University	The TranScript Project: Music From Poems	The TranScript Project is an ongoing commissioning effort by flutist and poet Wayla J. Chambo that explores the intersections and interactions of text and music. Composers are offered a selection of Chambos poems and asked to use one to construct a piece for solo flute or flute with electronics.	2016-03-06 19:30:00 Sun	Uncategorized	http://ruevents.rutgers.edu/events/displayEvent.html?eventId=83355	
Rutgers University	Catholic Mass	Full Mass with prayer, scripture, music, reception of Communion  Takes place at St. Peters Church, 94 Somerset St, CAC	2016-03-06 20:00:00 Sun	Uncategorized	http://ruevents.rutgers.edu/events/displayEvent.html?eventId=83661	
Rutgers University	Summer Session Info Table	Visit us at the LSC for information on Summer Session and giveaways!	2016-03-07 12:00:00 Mon	Uncategorized	http://ruevents.rutgers.edu/events/displayEvent.html?eventId=83786	
Rutgers University	Copyright Issues for Academic Research & Publication	The workshop will cover the basics of copyright including fair use, contract law as it applies to digital resources, use of copyrighted works in research and scholarly publications, copyright issues for dissertations and theses, copyright in one's own works, current copyright policies and more.	2016-03-07 14:00:00 Mon	Uncategorized	http://ruevents.rutgers.edu/events/displayEvent.html?eventId=83399	
Rutgers University	Rutgers Mingus Band	The music of bassist and bandleader Charles Mingus, featuring selections from "Blues and Roots" and "New Tijuana Moods." Tenor saxophonist and alum Abe Burton leads the ensemble.	2016-03-07 19:30:00 Mon	Uncategorized	http://ruevents.rutgers.edu/events/displayEvent.html?eventId=83334	
Rutgers University	Dealing with Different Levels of Academic Preparation in the Classroom	As an instructor, you will have students who have great difficulty in grasping even the most basic concepts of the class.  Some of the students will continue to try to learn the material while others may give up. What should your role be, as the instructor, to help them?	2016-03-08 12:00:00 Tue	Uncategorized	http://ruevents.rutgers.edu/events/displayEvent.html?eventId=83608	
Rutgers University	Summer Session Info Table	Visit us at the CASC for information on Summer Session and giveaways!	2016-03-08 12:00:00 Tue	Uncategorized	http://ruevents.rutgers.edu/events/displayEvent.html?eventId=83787	
Rutgers University	Mindfulness Meditation	Mindfulness is the art of being a compassionate observer of our own experience.  Mindfulness meditation helps us reduce stress & be calmer.  All are welcome, beginners and those with previous experience.  Workshops are free.  No registration, special clothes or equipment required.	2016-03-08 12:00:00 Tue	Uncategorized	http://ruevents.rutgers.edu/events/displayEvent.html?eventId=83489	
Rutgers University	Building Inclusion into the Millennial City	In this lecture we will look at recent trends, chart out national future prospects, suggest alternative scenarios for local areas and identify policies, practices, and incentives that could make millennial cities more inclusive in 50 years than today's baby boomer cities.	2016-03-08 16:30:00 Tue	Uncategorized	http://ruevents.rutgers.edu/events/displayEvent.html?eventId=83218	
Rutgers University	CSA Spirit Night	Spirit Night is the Catholic Student Associations weekly meeting, involving a topic, prayer,  & music. All undergrads welcome. Tonight we welcome a guest speaker, whose topic is "Breaking The Cycle".	2016-03-08 20:00:00 Tue	Uncategorized	http://ruevents.rutgers.edu/events/displayEvent.html?eventId=83598	
Rutgers University	Greenhouse Production Short Course	Come learn about the exciting world of greenhouse production! In this two-day class, our team of expert instructors will cover the core topics you need to either get your greenhouse off the ground or improve an existing program.	2016-03-07 08:30:00 Mon	Uncategorized	http://ruevents.rutgers.edu/events/displayEvent.html?eventId=83711	
Rutgers University	Managing Turfgrass & Landscape Weeds	Taught by Scott Guiser, Extension Educator, Penn State University, this two-day turf management class will explain the aspects of a comprehensive weed control program.	2016-03-07 09:00:00 Mon	Uncategorized	http://ruevents.rutgers.edu/events/displayEvent.html?eventId=81889	
Rutgers University	Roadside and Right-Of-Way Vegetation Management	This one-day class provides pesticide credits in the right-of-way category, and it focuses exclusively on the challenges of managing vegetation along highways, byways and rights-of-way.	2016-03-09 08:30:00 Wed	Uncategorized	http://ruevents.rutgers.edu/events/displayEvent.html?eventId=81930	
Rutgers University	Rutgers Women's Tennis	Women's Tennis vs. Longwood	2016-03-09 12:00:00 Wed	Uncategorized	http://ruevents.rutgers.edu/events/displayEvent.html?eventId=83158	
Rutgers University	Summer Session Info Table	Visit us at the BSC for information on Summer Session and giveaways!	2016-03-09 12:00:00 Wed	Uncategorized	http://ruevents.rutgers.edu/events/displayEvent.html?eventId=83788	
Rutgers University	Mindfulness Meditation	Mindfulness is the art of being a compassionate observer of our own experience.  Mindfulness meditation helps us reduce stress & be calmer.  All are welcome, beginners and those with previous experience.  Workshops are free.  No registration, special clothes or equipment required.	2016-03-09 12:00:00 Wed	Uncategorized	http://ruevents.rutgers.edu/events/displayEvent.html?eventId=83508	
Rutgers University	Networking and Social Media	Networking is the single most effective way to gain knowledge about careers and create job opportunities. Skilled and proactive networking is essential in today's competitive employment market. With the rapid growth of social media and sites like LinkedIn, networking now takes place b...	2016-03-09 12:00:00 Wed	Uncategorized	http://ruevents.rutgers.edu/events/displayEvent.html?eventId=83242	
Rutgers University	Neurology Grand Rounds	Modeling Autism Spectrum Disorders: From Mouse Mutants to Induced Human Neural Stem Cells	2016-03-09 12:30:00 Wed	Uncategorized	http://ruevents.rutgers.edu/events/displayEvent.html?eventId=83431	
Rutgers University	Drawing Club for Children and Young People: 6-8YO and 9-14YO	Children discover the secrets of drawing when they participate in the Zimmerlis popular Drawing Club, which takes place on Wednesdays after school in the fall and spring semesters.	2016-03-09 16:15:00 Wed	Uncategorized	http://ruevents.rutgers.edu/events/displayEvent.html?eventId=83418	
Rutgers University	A Celebration of Maslenitsa	Join the Russian Program for its annual celebration of Maslenitsa, the Russian version of Mardi Gras or Carnival, marking the week before Lent.	2016-03-09 16:30:00 Wed	Uncategorized	http://ruevents.rutgers.edu/events/displayEvent.html?eventId=83728	
Rutgers University	Spring 2016 Craig Lecture	The German Department is pleased to welcome Professor Martin Schaefer, Spring 2016 Charlotte M. Craig Distinguished Visiting Professor (University of Hamburg) to present the Spring 2016 Craig Lecture.	2016-03-10 04:30:00 Thu	Uncategorized	http://ruevents.rutgers.edu/events/displayEvent.html?eventId=82903	
Rutgers University	Krueckeberg Doctoral Conference	With the growing recognition of the Bloustein School as a major contributor to urban planning and policy studies, the Krueckeberg Conference has grown into a showcase of some of the most unique and forward-thinking research in the discipline of planning and policy.	2016-03-10 08:00:00 Thu	Uncategorized	http://ruevents.rutgers.edu/events/displayEvent.html?eventId=83819	
Rutgers University	The 2016 Russell Nutrition Symposium	The New US Dietary Guidelines
Nutritional Perspectives and Public Health Consequences	2016-03-10 09:00:00 Thu	Uncategorized	http://ruevents.rutgers.edu/events/displayEvent.html?eventId=83773	
Rutgers University	Summer Session Info Table	Visit us at the DSC for information on Summer Session and giveaways!	2016-03-10 12:00:00 Thu	Uncategorized	http://ruevents.rutgers.edu/events/displayEvent.html?eventId=83789	
Rutgers University	Mindfulness Meditation	Mindfulness is the art of being a compassionate observer of our own experience.  Mindfulness meditation helps us reduce stress & be calmer.  All are welcome, beginners and those with previous experience.  Workshops are free.  No registration, special clothes or equipment required.	2016-03-10 12:00:00 Thu	Uncategorized	http://ruevents.rutgers.edu/events/displayEvent.html?eventId=83530	
Rutgers University	Two Piano Spectacular	Min Kwon and friends performing two piano works by Paul Reale
Program includes Paul Reales Little Screamers, Minuet in GWhiz, Chorales II, Serge P, Drowsey Maggie, CPE, and World of a Bengal Child.	2016-03-10 15:00:00 Thu	Uncategorized	http://ruevents.rutgers.edu/events/displayEvent.html?eventId=83729	
Rutgers University	Ecology and Evolution Graduate Program: Dr. Tadushi Fukami - "Embracing historical contingency in community assembly"	All E&E seminars are open to the public.	2016-03-10 16:00:00 Thu	Uncategorized	http://ruevents.rutgers.edu/events/displayEvent.html?eventId=83758	
Rutgers University	Visiting Filmmaker Series: Daniel Hui, "Snakeskin"	Part dream documentary, party city symphony, this hybrid film traces the lineage of oppression as inscribed both in Singapores physical landscape, as well as its collective unconsciousa thoughtful look at the legacy and future of this Southeast Asian island.	2016-03-10 18:00:00 Thu	Uncategorized	http://ruevents.rutgers.edu/events/displayEvent.html?eventId=83810	
Rutgers University	Mason Gross Pops: Imani Meets Many!	Featuring the Imani Winds and the Rutgers Symphonic Winds and Symphony Band.	2016-03-10 19:30:00 Thu	Uncategorized	http://ruevents.rutgers.edu/events/displayEvent.html?eventId=83335	
Rutgers University	Operation & Maintenance of Pumps	In this popular hands-on course, you will learn and practice accepted procedures for both daily and long term maintenance of pumps and related equipment.	2016-03-08 08:30:00 Tue	Uncategorized	http://ruevents.rutgers.edu/events/displayEvent.html?eventId=81456	
Rutgers University	Recycling Public Policy	The passage of the Recycling Enhancement Act means, change, change and more change! This class will provide the information you and your business, school or recycling program need to know to be ahead of the crowd.	2016-03-11 08:30:00 Fri	Uncategorized	http://ruevents.rutgers.edu/events/displayEvent.html?eventId=81726	
Rutgers University	Understanding SOX9 function in development and human disease	The SOX9 transcription factor is required for normal embryonic development and is often overexpressed in human cancer. The Pine Lab seeks to define how SOX9 is regulated as well as to uncover the versatile functions of SOX9 during carcinogenesis and tumor progression	2016-03-11 09:15:00 Fri	Uncategorized	http://ruevents.rutgers.edu/events/displayEvent.html?eventId=83697	
Rutgers University	TBD	TBD	2016-03-11 11:00:00 Fri	Uncategorized	http://ruevents.rutgers.edu/events/displayEvent.html?eventId=83687	
Rutgers University	2 Day CME/CE Activity:Treating Tobacco Dependence in Behavioral Health Settings	Smoking rates in individuals with a mental illness or addiction are at least double that of the general population. A growing body of research reveals that smokers with mental illness want to quit tobacco, are able to quit, and quitting does not threaten their recovery process.	2016-03-10 08:30:00 Thu	Uncategorized	http://ruevents.rutgers.edu/events/displayEvent.html?eventId=83094	
Rutgers University	Zimmerli Drawing Society for Adults	Drawing has never ceased to be a fundamental tool of human perception and knowledge, akin to writing itself. Now the Zimmerli offers advanced and beginning artists, children and adults, an opportunity to draw, from both live models and the museums collection.	2016-03-12 12:30:00 Sat	Uncategorized	http://ruevents.rutgers.edu/events/displayEvent.html?eventId=83424	
Rutgers University	Catholic Mass	Full Mass with prayer, scripture, music, reception of Communion  Takes place at St. Peters Church, 94 Somerset St, CAC	2016-03-13 20:00:00 Sun	Uncategorized	http://ruevents.rutgers.edu/events/displayEvent.html?eventId=83662	
Rutgers University	Summer Online Information Session	Want to learn more about the Rutgers University-New Brunswick Summer Session? Join us for an online information session and have a chance to win free summer tuition. Register and view more event information here: http://summer.rutgers.edu/attend-online-information-session	2016-03-15 11:00:00 Tue	Uncategorized	http://ruevents.rutgers.edu/events/displayEvent.html?eventId=83263	
Rutgers University	Mindfulness Meditation	Mindfulness is the art of being a compassionate observer of our own experience.  Mindfulness meditation helps us reduce stress & be calmer.  All are welcome, beginners and those with previous experience.  Workshops are free.  No registration, special clothes or equipment required.	2016-03-15 12:00:00 Tue	Uncategorized	http://ruevents.rutgers.edu/events/displayEvent.html?eventId=83490	
Rutgers University	Landscape Lighting: Design & LED Technology	Landscape Lighting is a great opportunity to expand your services and value to existing customers. However, working with electricity requires an entirely new skill set and vocabulary. That is what you will learn in this 1½-day class. Class ends at 12:00pm on March 15.	2016-03-14 09:00:00 Mon	Uncategorized	http://ruevents.rutgers.edu/events/displayEvent.html?eventId=81890	
Rutgers University	Introduction to Pruning Techniques	In this popular hands-on, one-day course, Rutgers Gardens Director Bruce Crawford will provide practice and guided instruction in how to properly prune while preserving a plant's natural vigor and beauty.	2016-03-16 09:00:00 Wed	Uncategorized	http://ruevents.rutgers.edu/events/displayEvent.html?eventId=81861	
Rutgers University	Don't Panic! Field Repairs for Small Engines	In this hands-on, one-day class, instructor Joe Clark will show you the most common fixes for the most common breakdowns. Then you will pick up a set of tools and practice what you've learned on real engines.	2016-03-16 09:00:00 Wed	Uncategorized	http://ruevents.rutgers.edu/events/displayEvent.html?eventId=81932	
Rutgers University	Mindfulness Meditation	Mindfulness is the art of being a compassionate observer of our own experience.  Mindfulness meditation helps us reduce stress & be calmer.  All are welcome, beginners and those with previous experience.  Workshops are free.  No registration, special clothes or equipment required.	2016-03-16 12:00:00 Wed	Uncategorized	http://ruevents.rutgers.edu/events/displayEvent.html?eventId=83509	
Rutgers University	Neurology Grand Rounds	Current Advances in the Care of Drug Resistant Epilepsy	2016-03-16 12:30:00 Wed	Uncategorized	http://ruevents.rutgers.edu/events/displayEvent.html?eventId=83376	
Rutgers University	Drawing Club for Children and Young People: 6-8YO and 9-14YO	Children discover the secrets of drawing when they participate in the Zimmerlis popular Drawing Club, which takes place on Wednesdays after school in the fall and spring semesters.	2016-03-16 16:15:00 Wed	Uncategorized	http://ruevents.rutgers.edu/events/displayEvent.html?eventId=83419	
Rutgers University	Ecological Risk Assessment: Practice and Protocols	This two-day program will provide you with a comprehensive overview of regulatory expectations of ecological risk assessments from both federal and state perspectives.	2016-03-15 09:00:00 Tue	Uncategorized	http://ruevents.rutgers.edu/events/displayEvent.html?eventId=83009	
Rutgers University	Advanced Pruning Techniques	There's no substitute for true hands-on learning, and this class has plenty of it. Steve Schuckman, owner, First Mountain Arboriculture LLC, will guide you through classroom (minimal) and field demonstrations (mostly) to ensure you gain a strong understanding of how pruning should be done.	2016-03-17 09:00:00 Thu	Uncategorized	http://ruevents.rutgers.edu/events/displayEvent.html?eventId=81891	
Rutgers University	Mindfulness Meditation	Mindfulness is the art of being a compassionate observer of our own experience.  Mindfulness meditation helps us reduce stress & be calmer.  All are welcome, beginners and those with previous experience.  Workshops are free.  No registration, special clothes or equipment required.	2016-03-17 12:00:00 Thu	Uncategorized	http://ruevents.rutgers.edu/events/displayEvent.html?eventId=83531	
Rutgers University	Core Basic Training - Bilingual Instruction	The Core Training Program is a basic pest control training course for those that are interested in becoming a Pest Control Operator. This course is taught in English and Spanish.	2016-03-17 12:30:00 Thu	Uncategorized	http://ruevents.rutgers.edu/events/displayEvent.html?eventId=81795	
Rutgers University	Ecology and Evolution Gradaute Program Seminar: Dr. Jason Kolbe	All E&E seminars are open to the public.	2016-03-17 16:00:00 Thu	Uncategorized	http://ruevents.rutgers.edu/events/displayEvent.html?eventId=83759	
Rutgers University	Rutgers Gardens Winter Farm Market	Come out to support our farm market vendors and enjoy some locally produced and prepared products. 3rd Friday of each month, January through April, weather permitting. Vendors may vary each month. Join our mailing list to receive updates on vendors and specials they will have available.	2016-03-18 11:00:00 Fri	Uncategorized	http://ruevents.rutgers.edu/events/displayEvent.html?eventId=83576	
Rutgers University	40th Annual Home Gardeners School	The Home Gardeners School offers you expert instruction in the most innovative gardening and landscaping subjects available.	2016-03-19 09:00:00 Sat	Uncategorized	http://ruevents.rutgers.edu/events/displayEvent.html?eventId=81600	
Rutgers University	Zimmerli Drawing Society for Adults	Drawing has never ceased to be a fundamental tool of human perception and knowledge, akin to writing itself. Now the Zimmerli offers advanced and beginning artists, children and adults, an opportunity to draw, from both live models and the museums collection.	2016-03-19 12:30:00 Sat	Uncategorized	http://ruevents.rutgers.edu/events/displayEvent.html?eventId=83425	
Rutgers University	Rutgers Women's Tennis	Women's Tennis vs. Illinois	2016-03-19 12:30:00 Sat	Uncategorized	http://ruevents.rutgers.edu/events/displayEvent.html?eventId=83160	
Rutgers University	Rutgers Women's Tennis	Women's Tennis vs. Indiana	2016-03-19 18:00:00 Sat	Uncategorized	http://ruevents.rutgers.edu/events/displayEvent.html?eventId=83159	
Rutgers University	Music at the Museum	The Zimmerli hosts a monthly weekend concert series organized by the Mason Gross Extension Division and featuring artists from Mason Gross School of the Arts Extension Division and Collegiate Music Department.	2016-03-20 13:00:00 Sun	Uncategorized	http://ruevents.rutgers.edu/events/displayEvent.html?eventId=82579	
Rutgers University	Catholic Mass	Full Mass with prayer, scripture, music, reception of Communion  Takes place at St. Peters Church, 94 Somerset St, CAC	2016-03-20 20:00:00 Sun	Uncategorized	http://ruevents.rutgers.edu/events/displayEvent.html?eventId=83663	
Rutgers University	Landscape Project Management	Many project problems originate during the transfer from sales to production. Other problems occur due to poor project preparation. Marcus VandeVliet will show you how to make the transfer smooth and the preparation complete.	2016-03-21 09:00:00 Mon	Uncategorized	http://ruevents.rutgers.edu/events/displayEvent.html?eventId=81898	
Rutgers University	Don't Panic! Field Repairs for Small Engines	In this hands-on, one-day class, instructor Joe Clark will show you the most common fixes for the most common breakdowns. Then you will pick up a set of tools and practice what you've learned on real engines.	2016-03-21 09:00:00 Mon	Uncategorized	http://ruevents.rutgers.edu/events/displayEvent.html?eventId=81933	
Rutgers University	Summer Session Info Table	Visit us at the DSC for information on Summer Session and giveaways!	2016-03-21 12:00:00 Mon	Uncategorized	http://ruevents.rutgers.edu/events/displayEvent.html?eventId=83790	
Rutgers University	Curtis on Tour	Selections include Prélude à l'après-midi d'un faune and Sonata (flute, viola, harp) by Debussy, Beloved Night by Danielpour, Sonata for Flute and Harp, Op. 56 by Liebermann, Duo for Violin and Cello by Weinberg, and Shéhérazade by Ravel.	2016-03-21 19:30:00 Mon	Uncategorized	http://ruevents.rutgers.edu/events/displayEvent.html?eventId=83336	
Rutgers University	Management Skills for Supervisors	In our highly popular two-day Management Skills for Supervisors short course, we will explore the essential characteristics of respected leaders and how they create and sustain productive organizations.	2016-03-22 08:30:00 Tue	Uncategorized	http://ruevents.rutgers.edu/events/displayEvent.html?eventId=82675	
Rutgers University	Glacial Deposits of New Jersey	In this course, morning lecture-format presentations will be followed by an afternoon field trip to provide students the opportunity to examine several types of glacial sediment first-hand.	2016-03-22 09:00:00 Tue	Uncategorized	http://ruevents.rutgers.edu/events/displayEvent.html?eventId=83071	
Rutgers University	Summer Session Info Table	Visit us at the LSC for information on Summer Session and giveaways!	2016-03-22 12:00:00 Tue	Uncategorized	http://ruevents.rutgers.edu/events/displayEvent.html?eventId=83791	
Rutgers University	Mindfulness Meditation	Mindfulness is the art of being a compassionate observer of our own experience.  Mindfulness meditation helps us reduce stress & be calmer.  All are welcome, beginners and those with previous experience.  Workshops are free.  No registration, special clothes or equipment required.	2016-03-22 12:00:00 Tue	Uncategorized	http://ruevents.rutgers.edu/events/displayEvent.html?eventId=83491	
Rutgers University	The Role of the Environmental Consultant in Litigation	This half-day program is designed to prepare environmental professionals to participate effectively in litigation and other legally oriented proceedings.	2016-03-23 09:00:00 Wed	Uncategorized	http://ruevents.rutgers.edu/events/displayEvent.html?eventId=81714	
Rutgers University	DECISIONS: Choose a Major that Fits You	Start moving toward your career goals by attending this workshop to help you identify the following:

1. In what field of study do you have the most interest?
2. How far do you want to go in your educational development?
3. What kind of work activities would you most like after colleg...	2016-03-23 10:00:00 Wed	Uncategorized	http://ruevents.rutgers.edu/events/displayEvent.html?eventId=83225	
